"Name","Country","Traveler Type","Score","Score Explanation","Date","Pros","Cons","Response","Pros Original","Cons Original","Response Original"
"Mariia","Russia","Couple","9.2","Superb","11 December 2013","Wonderful breakfast! Number liked its design, but our friends confused by a glass partition between the bathroom and the toilet :)","","","Замечательный завтрак! Номер понравился своим дизайном, но наших друзей смутил стеклянной перегородкой между комнатой и туалетом:)","","",
"Niels","Denmark","Couple","7.5","Good","7 December 2013","Very Monoresort Compared to the price, and that there was a locked row - Basement","There should be wi-fi in the rooms and not only for cable Wi-fi only
available in reception and bar","","Meget valata I forhold til prisen, samt at der var aflåst p - Kælder","Der burde være Wi-fi på værelserne og ikke kun til kable Wi-fi kun
tilgængeligt I reception og bar","",
"Sergio","Spain","Couple","10","Exceptional","6 December 2013","","Not having wifi in rooms","","","No tener wifi en las habitaciones","",
"Jana","Germany","Solo traveller","9.6","Exceptional","5 December 2013","Very friendly and courteous contact at the reception. Overall good level of equipment / ambience of the room.
In my job often in Berlin and know some hotels in Wilmersdorf / Charlottenburg. In the energy hotel I stay at the most.","","","Sehr freundlicher und zuvorkommender Kontakt an der Rezeption. Insgesamt gutes Ausstattungsniveau/Ambiente der Zimmer. 
Bin beruflich oft in Berlin und kenne einige Hotels in Wilmersdorf/Charlottenburg. Im Energie Hotel übernachte ich am liebsten.","","",
"Steven","Belgium","Couple","7.1","Good","30 November 2013","The rooms are perfectly fine for this price! The location is almost perfect for a city trip.","The staff we found not friendly. The S-Bahn - even at night - comes several times an hour, you can hear well in the room.","","De kamers zijn dik in orde voor deze prijzen! De ligging is quasi ideaal voor een citytripje.","Het personeel vonden we niet vriendelijk. De S-Bahn die - ook 's nachts - meerdere malen per uur langskomt, hoor je goed in de kamer.","",
"Olga","Spain","Couple","7.1","Good","28 November 2013","It is conveniently located near the shopping street and a Ku'Dam
train station. Comfortable and clean. Very comfortable.","The bathroom is not very intimate. It is separated from the rest of the room as
just a frosted glass, in case of traveling with your partner no
problem, but if it is not the case ...","","Está muy bien ubicado cerca de la comercial calle Ku'Dam y de una
estación de tren. Confortable y limpio. Muy cómodo.","El baño es poco íntimo. Está separado del resto de la habitación por tan
sólo un cristal al ácido, que en caso de viajar con tu pareja no hay
problema, Pero si no es el caso...","",
"Rocio","Spain","Couple","7.9","Good","28 November 2013","The cleanliness of the room very good. The great location, 5 minutes from buses and trains, and commercial area with many stalls and cheap restaurants to eat and move everywhere with the most central bus about 10 or 15 minutes walking.","The basin is separated only by glass, even to go as a couple, there are certain moments that you prefer to have an intimacy. It was very inconvenient to have to always go down to reception to connect to wifi. The curtains a little old, but no problem. The very expensive breakfast and bar prices too.","","La limpieza de la habitación muy buena. La ubicación genial, a 5 minutos de buses y trenes, y zona comercial con muchos puestos y restaurantes donde comer barato y moverte a todas partes con los autobuses más céntricos a unos 10 o 15 minutos caminando.","El lavabo solo esta separado por un cristal, por mucho que vayas en pareja hay ciertos momentos que prefieres tener una intimidad. Era muy incómodo tener que bajar siempre a recepción para conectarte a wifi. Las cortinas un poco antiguas, pero sin problema. El desayuno muy caro y los precios del bar también.","",
"Péter","Hungary","Couple","8.3","Very good","28 November 2013","Sauvigny near the station, within easy reach of the main tourist spots. The accommodation clean and tidy, demanding. The check-in and check in easy.","The heat had set for ourselves, otherwise it would have been a little cold.","","Közel a Sauvigny megálló, könnyen elérhetőek a fontosabb turisztikai pontok. A szállás tiszta, rendezett, igényes. A ki- és becsekkolás könnyen megy.","A fűtést önmagunknak kellett beállítani, egyébként kicsit hideg lett volna.","",
"Jutta","Germany","Solo traveller","9.2","Superb","24 November 2013","Central location; great price-performance ratio","Breakfast price is quite high; That one gets in a cafe around for little money.
Volume of the nearby S-Bahn line is used to. I had this ear plugs and could sleep well.","","Zentrale Lage; super Preis-Leistungsverhältnis","Frühstückspreis recht hoch; Das bekommt man in einem Cafe der Umgebung für kleines Geld.
Lautstärke der naheliegenden S-Bahnlinie ist gewöhnungsbedürftig. Ich hatte Ohropax dabei und konnte gut schlafen.","",
"Emmy","Netherlands","Couple","8.8","Fabulous","21 November 2013","Good location, close to public transport, nice staff, the room was clean and good value for money","","","Goede locatie, dicht bij openbaar vervoer, aardig personeel, de kamer was netjes en goede prijs- kwaliteitverhouding","","",
"Javier","Spain","Couple","6","Pleasant","18 November 2013","the price of the hotel is good and all is well kept and clean. Spanish employees plus several that are useful if you have a problem with languages. at hotel no connection both bus and metro and train as a curiosity and right next door is a Spanish restaurant.","it is not entailing any serious disorder but to go from reception to the room is to leave the hotel go through another door.","","el precio del hotel es bueno y todo está bastante cuidado y limpio. además hay varios empleados españoles que son útiles si tienes algún problema con los idiomas. al lado del hotel hay conexión tanto de autobús como metro y tren y como curiosidad justo al lado hay un restaurante español.","no es que suponga ningún trastorno serio pero para ir de la recepción a la habitación hay que salir del hotel entrar por otra puerta.","",
"Tetyana","Germany","Solo traveller","10","Exceptional","17 November 2013","I was thrilled. Everything was just perfect. Thank you!","","","Ich war begeistert. Alles war einfach perfekt. Danke!","","",
"Birgit","Germany","Group of friends","7.9","Good","4 November 2013","The location is very central. Our rooms were fairly new and the design was consistent. Breakfast for 10 EUR relatively expensive, but with Prosecco.","Something loud. The principle of circulating air, which could be stopped by switching off the entire stream is a bit annoying: loud and fresh air far away. Unusual: The room we were allocated for two persons was significantly smaller than the single room. Have cost both 108 EUR for two nights.","","Die Lage ist sehr zentral. Unsere Zimmer waren recht neu und das Design war stimmig. Frühstück für 10 EUR relativ teuer, aber mit Prosecco.","Etwas laut. Das Prinzip der Umluft, das sich nur durch Ausschalten des gesamten Stroms stoppen ließ, ist etwas lästig: laut und von Frischluft weit entfernt. Ungewöhnlich: Das uns zugewiesene Zimmer für zwei Personen war deutlich kleiner als das Einzelzimmer. Gekostet haben beide 108 EUR für zwei Nächte.","",
"Erika","Italy","Couple","9.2","Superb","3 November 2013","Hotel convenient to girarre Berlin, within walking distance of metro and bus stop also. Very clean conarredamento quite modern. Staff always helpful and relationship quality / price excellent.","The only flaw is that you can see from the shower room where friends could be embarrassing, it was not my case, but I say to those who would choose it.","","Albergo comodissimo per girarre Berlino, metrò a pochi passi e anche fermata dell'autobus. Molto pulito conarredamento piuttosto moderno. Staff sempre disponibile e rapporto qualità/prezzo ottimo.","L'unica pecca è la doccia che si vede dalla camera in caso di amici potrebbe essere imbarazzante, non era il mio caso ma lo dico per chi volesse sceglierlo.","",
"Maria-luise","Germany","Family","8.8","Fabulous","3 November 2013","great central location, within a few minutes at the Ku-Damm, S-Bahn Savigny-Platz, good places in the immediate vicinity, the hotel very clean and functional.","Although is very centrally located, but also directly to the web, but is ok, because this night only little leaves","","super zentrale Lage, zu Fuß in wenigen Minuten am Ku-Damm, S-Bahn Savigny-Platz, gute Lokalitäten in direkter Umgebung, Hotel sehr sauber und zweckmäßig.","liegt zwar sehr zentral, aber eben auch direkt an der Bahn, ist aber o.k., da diese nachts nur wenig fährt","",
"Claudia","Germany","Family","7.9","Good","3 November 2013","Great, super modern, pleasing and very clean. Location central. Delicious buffet breakfast in pleasant atmosphere with plenty of choice (which is worth 10 euros).","TV automatically goes to, but not anymore! A lift defective, staff could be a little more committed. Location next to S-Bahn, but not stop in front of the house.","","Tolle, supermoderne, ansprechende Einrichtung und sehr sauber. Lage zentral. Leckeres Frühstücksbuffet in angenehmer Atmosphäre mit viel Auswahl (ist die 10 Euro wert).","Fernseher geht automatisch an, aber nicht mehr aus! Ein Lift defekt, Personal könnte etwas engagierter sein. Lage direkt neben S-Bahn, aber Haltestelle nicht vor dem Haus.","",
"Wiebke","Netherlands","Couple","7.5","Good","3 November 2013","The location was excellent, one of the nicest parts of Berlin.
Breakfast was ok.","The S-Bahn and underground which directly next to the hotel every few minutes past thundered from early morning to late evening.
The glass door of the bathroom where you could look through it I find annoying, and who also did not like the "odors" against.","","De locatie was uitstekend, in één van de leukste delen van Berlijn.
Ontbijt was ok.","De S-Bahn en metro die direkt naast het hotel om de zoveel minuten voorbij denderde van 's morgens vroeg tot 's avonds laat.
De glazen deur van de badkamer waar je door heen kon kijken, vind ik vervelend, en die ook de 'luchtjes' niet tegen hield.","",
"Jana","Germany","Couple","7.9","Good","19 October 2013","The situation in the city and near the car park behind the hotel also own the bar in the hotel and the fridge in the room","I did not like that was not mentioned in the description for the hotel to be close to E-train so that the nights were a little uneasy.","","Die Lage in der stadtnähe sowie der eigene Parkplatz hinter dem Hotel außerdem die Bar im Hotel und der Kühlschrank im Zimmer","Mir hat nicht gefallen das in der Beschreibung für das Hotel die Nähe zu E-Bahn nicht erwähnt wurde so das die Nächte etwas unruhig waren.","",
"Aleksey","Russia","Solo traveller","7.9","Good","18 October 2013","Large rooms, decorated in the style of hi-tech,
filtriatsiya air
decent breakfast for an extra 10 euros.","XXI century, the center Brelin - and there is no wi-fi in the rooms, only in the reception.
heard passing near the fairing S-Train, but the noise is not significant.","","Большие номера, оформление в стиле hi-tech,
фильтриация воздуха,
неплохой завтрак за дополнительные 10 евро.","XXI век, центр Брелина -  и нет wi-fi в номерах, только в на ресепшен.
слышно проходящие рядом с гостинецей S-Train, но шум не значителен.","",
"Tilmann","Germany","Couple","7.5","Good","18 October 2013","Very good is the price-performance-ratio (at the time of booking: 39, - Euro for 2 people in a double room) with the exception of breakfast (10, - Euro per person), which was however offered with a good selection and fresh ingredients. The staff was very friendly, a bit inexperienced though the breakfast area. Good location in the city center is (sacrificing only for the nearby S-Bahn sounds) and in this respect the parking at the hotel, providing us with 8, - Euro per night seems appropriate.","By omitting another space-absorbing door in favor of the rooms face the washing and toilet area can not be used discreetly. For the shower room is pleasantly spacious. The thick pillows are ideal for sitting in bed (eg when reading or watching TV), to sleep, they are less well suited. To think in time you can look at at reception can provide additional thinner pillow or bring up with your own.","","Sehr gut ist das Preis-Leistungs-Verhältnis (zur Zeit der Buchung: 39,- Euro für 2 Personen im Doppelzimmer) mit Ausnahme des Frühstücks (10,- Euro pro Person), welches jedoch mit guter Auswahl und frischen Zutaten angeboten wurde. Das Personal war sehr freundlich, wenn auch im Frühstücksbereich noch etwas unerfahren. Gut ist die Lage in der Innenstadt (Abstriche nur wegen der nahen S-Bahn-Geräusche) und diesbezüglich die Parkmöglichkeit am Hotel, die uns mit 8,- Euro pro Nacht angemessen erscheint.","Durch Verzicht auf eine weitere raumschluckende Tür zugunsten der Zimmerfläche kann der Wasch- und WC-Bereich nicht diskret benutzt werden. Dafür ist die Duschkabine angenehm geräumig. Die dicken Kopfkissen eignen sich sehr gut zum Sitzen im Bett (z.B. beim Lesen oder Fernsehgucken), zum Schlafen sind sie weniger gut geeignet. Wenn man daran rechtzeitig denkt, lässt man sich an der Rezeption zusätzliche dünnere Kissen geben oder bringt sich eigene mit.","",
"Bernd","Germany","Couple","8.8","Fabulous","16 October 2013","Nice, clean, quite spacious Dz, modern bathroom,
Quiet despite location directly to S-Bahn
Fast good service beim.aus and check in! Super location in.city West","","","Schoenes, sauberes, recht großzügiges Dz, modernes bad,
Ruhig trotz lage direkt an S-Bahn
Schneller guter Service beim.aus-und einchecken! Superlage in.city west","","",
"Pierre","Austria","Couple","8.3","Very good","15 October 2013","& Gt; Room cleanliness
- & Gt; breakfast consisting
- & Gt; not as noisy same side train (travel in October so windows closed)
- & Gt; 5 min from Metro
- & Gt; perfect for shopping (KufurstendammStrasse)
- & Gt; Quality / Price ++","& Gt; No wifi in rooms
- & Gt; Private bathroom but in the same separated by an opaque glass room","","> La propreté des chambres
-> le petit déjeuner consistant
-> pas aussi bruyant même coté train (voyage en Octobre donc fenêtres fermés)
-> à 5 min du Métro
-> parfait pour shopping (KufurstendammStrasse)
-> Qualité/Prix ++","> Pas de wifi dans les chambres
-> Salle de bain individuelle mais dans la même pièce séparée par une vitre opaque","",
"Maria","Germany","Group of friends","6.7","Pleasant","11 October 2013","Breakfast was good and plentiful.
Rooms were clean.","Little comfort in the room, for example, merely a cosmetic tissue in the bathroom. Rooms look very cool, for example. no pictures on the wall. Uncomfortable pillows.","","Frühstück war gut und reichhaltig.
Zimmer waren sauber.","Wenig Komfort im Zimmer, z.b. lediglich ein Kosmetiktuch im Bad. Zimmer wirken sehr kühl, zb. keine Bilder an der Wand. Unbequeme Kopfkissen.","",
"Olga","Russia","Couple","8.3","Very good","7 October 2013","Quiet, calm is not an expensive hotel. The staff are friendly and there is a Russian-speaking woman at the reception desk. The location is quite convenient. Modern bathroom.","No internet !!! Toilet in the room is right next to the bed and separated by a small door with glass mat. Very awkward and uncomfortable when you travel not alone.","","Тихий, спокойный не дорогой отель. Персонал приветливый и есть рускоговорящая девушка на рецепции. Расположение довольно удобное. Комната современная.","Нет интернета!!! Унитаз в комнате стоит прямо около кровати и отгорожен небольшой стекляной матовой дверцей. Очень неудобно и некомфортно, когда путешествуешь не один.","",
"Annabelle","France","Couple","7.5","Good","29 September 2013","Breakfast of great quality!
-The Modern rooms
-The Friendly and full of restaurants and cafes / bars friendly neighborhood!","The wifi only works in the public areas and cables loaned by receiving no walk in the rooms!","","Le petit déjeuner de grande qualité!
-La modernité des chambres
-Le quartier sympathique et riche en restaurants et cafés/bars conviviaux!","Le wifi ne fonctionne que dans les parties communes et les câbles prêtés par la réception de marchent pas dans les chambres!","",
"Hans","Spain","Couple","7.9","Good","27 September 2013","Hotel location, cleanliness","command to turn off the tv hard","","lugar del hotel, limpieza","mando de la television  dificil de apagar","",
"Michael","Germany","Couple","8.8","Fabulous","26 September 2013","Short walk to subway / bus.
Close some ways to eat / drink (almost around the clock);-)","","","Kurzer FussWeg zu S-Bahn/Bus.
In nächster Nähe etliche Möglichkeiten zum  Essen/Trinken (fast rund um die Uhr) ;-)","","",
"Thomas","Germany","Solo traveller","10","Exceptional","18 September 2013","Ventilation system, you need not open a window. Room good size. Breakfast was very good.","Noise from the adjacent S-Bahn","","Lüftungsanlage, man brauchte kein Fenster öffnen. Zimmer angenehm gross. Frühstück sehr gut.","Lärm von der benachbarten S-Bahn","",
"Magdalena","Poland","Couple","9.2","Superb","15 September 2013","parking","traveled with underground parking-you have to engage staff","","miejsca parkingowe","wyjazd z parkingu podziemnego-trzeba angażować personel","",
"Alessandro","Italy","Family","10","Exceptional","11 September 2013","Absolutely everything is OK, location, area, value for money, multilingual staff, availability, short, really everything very well","Nothing negative.
If we really want to get nit there is no breakfast included which costs a little expensive, but there is a bar near very good for all types of breakfast (sweet / salty) and at prices very normal, in addition to this, the entrance to the elevator access is not the best walls a little scuffed and minimum brightness ...... but really it is a detail, it is highly recommended","","Assolutamente tutto OK, posizione, zona, rapporto qualità prezzo, personale multilingua, disponibilità, insomma davvero tutto molto bene","Nulla di negativo.
Se vogliamo proprio trovare il pelo nell'uovo c'è la colazione non inclusa che costa un pò cara, ma vicinissimo c'è un bar davvero molto buono per colazioni di tutto tipo (dolce/salato) e a prezzi normalissimi, oltre a questo, l'entrata per l'accesso all'ascensore non è il massimo con pareti un pò scrostate e luminosita minima......ma davvero è un dettaglio, è comunque consigliatissimo","",
"Lydia","France","Group of friends","5.8","Okay","7 September 2013","Spacious, air-conditioned, comfortable, well-appointed.
Private parking behind the hotel + a large underground parking.
Conveniently located near the S-Bahn station.
A large bathroom.","For this trip of ten days:
A reception, changing constantly and rapidly overwhelmed (ex for use during a malfunction of safe, waiting in vain for 45 minutes staff. To home this time was on the staff the input of many people. problem was solved the next morning by a run on the phone handling).
The lack of privacy in the bathroom due to the interior design, glass enclosures limited in height.
The elevator dedicated to customers and allowing direct access to the corridors of the various stages from home, broke down during our stay. We used a lift service organization at the entrance of the hotel.
Failure of general hygiene:
succinct cleaning toilets, dusting the room, and sheets not changed during our stay.
A nice concept, but bad management to the detriment of the customer.","","Chambre spacieuse, climatisée, confortable, bien agencée.
Parking privé derrière l'hôtel + un grand parking souterrain.
Bien situé à proximité d'une station S-Bahn.
Une grande salle de bain.","Pour ce séjour d'une dizaine de jours :
A l'accueil, le personnel changeant constamment et rapidement débordé ( un ex. pour l'utilisation lors d'un défaut de fonctionnement du coffre-fort, attente vaine de 45 mn; à l'accueil à ce moment-là le personnel effectuait l'entrée de plusieurs personnes. Le problème a été résolu le lendemain matin par une manipulation gérée au téléphone).
Le manque d 'intimité de la salle de bain due à l'architecture intérieure, parois en verre limitée en hauteur.
L'ascenseur dédié à la clientèle et permettant l'accès direct aux couloirs des différents étages à partir de l'accueil, était en panne durant tout notre séjour. Nous utilisions un ascenseur de service annexe à l'entrée de l'hôtel.
Le manquement d'hygiène général :
nettoyage succinct des sanitaires, dépoussiérage de la chambre, et les draps non changés durant notre séjour.
Un beau concept, mais gestion déplorable au préjudice du client.","",
"Patrycja","Poland","Couple","9.2","Superb","6 September 2013","helpful and friendly staff, nicely decorated room, clean, close to the S-bahn and quick access to the center","Glazed Toilet","","pomocny i miły personel, ładnie urządzony pokój, czysto, blisko do stacji S-bahn i szybki dojazd do centrum","przeszklona toaleta","",
"Paolo","Italy","Group of friends","7.5","Good","3 September 2013","cleanliness and location.","difficulty of communication with the staff, the cost of breakfast.","","pulizia e posizione.","difficolta di comunicazione con lo staff, costo della colazione.","",
"Luciano","Italy","Group of friends","7.1","Good","3 September 2013","the position","the price of breakfast","","la posizione","il prezzo della colazione","",
"Andres","Colombia","Couple","7.9","Good","1 September 2013","All according to the hotel rate. Good location, near metro station and variety of restaurants in the area.","The sheets could be changed more often.","","Todo acorde a la tarifa del hotel. Ubicación buena, estación de metro cerca y variedad de restaurantes en la zona.","Las sábanas las podrían cambiar más seguido.","",
"Benedetta","Italy","Couple","8.8","Fabulous","26 August 2013","Large and comfortable room. Metro station very close","","","Camera ampia e confortevole. Stazione della metro molto vicina","","",
"Renate","Germany","Family","3.8","Poor","24 August 2013","Zentral located","The hotel I would not recommend it.
The dust in the room was clearly old, and begat by any regular care of the furniture, the bathroom had a shower curtain that I had not written normally with a barge pole, so came the mold musty odor in the bathroom.
The hotel is located directly on the web, so centrally located, but also correspondingly noisy.
This hotel I would not book case again.
We left early.","","Zentral gelegen","Das Hotel würde ich nicht empfehlen. 
Der Staub im Zimmer war deutlich alt und zeugte von keiner regelmäßigen Pflege des Mobiliars, das Bad verfügte über einen Duschvorhang, den ich im Normalfall nicht mit der Kneifzange abgefasst hätte, daher kam auch der Schimmel-Muffgeruch im Bad.
Das Hotel liegt direkt an der Bahn, damit zentral gelegen, aber auch dementsprechend laut.
Dieses Hotel würde ich auf keinen Fall noch einmal buchen.
Wir sind vorzeitig abgereist.","",
"Pietro","Italy","Couple","9.2","Superb","23 August 2013","Proximity of public transportation, cutting to the small park in front of the hotel you arrive at the station of the S-Bahn in 1 minute.","A couple of times they have redone the room, but it was enough to hang on to handle the special sign to not have any more problems.","","Vicinanza dei mezzi pubblici, tagliando per il piccolo parco davanti all'hotel si arriva alla stazione della S-Bahn in 1 minuto.","Un paio di volte non hanno rifatto la stanza, ma è bastato appendere alla maniglia l'apposito cartello per non avere più problemi.","",
"Paola","Argentina","Solo traveller","9.2","Superb","22 August 2013","The hotel is very modern and comfortable.
The staff speak perfect Spanish.
The room is very bright and large with fridge, desk, wardrobe and all the furniture is new.
The location is very good, the area is beautiful, there are restaurants and bars nearby, the train is 2 blocks away and the Metro 7.
There is a shopping strip where are 4 blocks from the big brands to the most accessible.
The area is very safe (as almost all Berlin).
Arriving from the airport (Tegel) collectively in 40 minutes maximum (two groups, in the office of the airport reports provide the itinerary)","The breakfast 10 euros per day is expensive.
Just wifi in the lobby, but if you bring laptop computer you get a cable to connect internet, it works perfect.","","El hotel es muy moderno y confortable.
El personal habla perfecto español.
La habitacion es muy luminosa y grande, tiene frigobar, escritorio, armario y todo el mobiliario es nuevo.
La ubicación es muy buena, la zona es hermosa, hay restaurantes y bares muy cerca, el tren esta a 2 cuadras y el metro a 7.
Hay una avenida de compras a 4 cuadras donde estan desde las grandes marcas hasta las mas accesibles.
La zona es muy segura (como casi todo Berlin).
Se llega desde el aeropuerto (Tegel) en colectivo en 40 minutos maximo (dos colectivos, en la oficina de informes del aeropuerto brindan el itinerario)","El desayuno 10 euros por dia es caro.
Solo tiene wifi en el lobby, pero si llevas computadora portatil te dan un cable para conectar internet, que funciona perfecto.","",
