"Name","Country","Traveler Type","Score","Score Explanation","Date","Pros","Cons","Response","Pros Original","Cons Original","Response Original"
"Anonymous","Czech Republic","Couple","9.6","Skvěly poměr ceny a kvality","17 August 2014","+ Modern, simple device
+ Very friendly and helpful staff
+ Non-smoking hotel
+ Clean rooms
+ Close to the center, good access to public transport
+ Parking in the yard for 8 € / day","Wifi only in public areas
- Cracked slats in the grate bed comfort and decreased quality of sleep
- Hotel is right off the track where trains run at a high frequency long into the night, but you can not sleep without earplugs","","+ Moderní, jednoduché zařízení
+ Velmi ochotný a příjemný personál
+ Nekuřácký hotel
+ Čisté pokoje
+ Blízko centra, dobrá dostupnost městskou hromadnou dopravou
+ Možnost parkování ve dvoře za 8 € / den"," Wifi pouze ve společných prostorách
- Prasklé lamely v roštu postele snížily kvalitu pohodlí a spánku
- Hotel je situován hned u trati, kde jezdí vlaky ve vysoké frekvenci dlouho do noci, ale dá se usnout i bez špuntů do uší","",
"Anonymous","Germany","Couple","8.3","Very good","12 August 2014","Furnishings is appropriate prktisch and cozy. The breakfast buffet was excellent.","The proximity to the railway line is connected to a high background noise, unfortunately! Earplugs were necessary.","","Einrichtung des Zimmers ist zweckmäßig, prktisch und gemütlich. Das Frühstücksbuffet war ausgezeichnet.","Die Nähe zur Bahnstrecke ist verbunden mit einem hohen Störlärm, leider! Ohrenstöpsel waren nötig.","",
"Anonymous","Germany","Couple","7.5","Good","9 August 2014","Despite the busy railway line: window, air conditioner, all good:-)
Many beautiful places in the area.","","","Trotz der viel befahrenen Bahnstrecke: Fenster zu, Klimaanlage an, alles gut :-)
Viele schöne Lokale in der Umgebung.","","",
"Anonymous","Germany","Couple","7.5","Good","30 July 2014","very good central location","the volume of the adjacent rail","","sehr gute zentrale Lage","die Lautstärke des angrenzenden Schienenverkehrs","",
"Anonymous","Germany","Couple","9.6","Exceptional","27 July 2014","","Not & quot; closed & quot; Bathroom / WC getting used to the room. The bathroom / WC is with frosted glass and (if not showered) quot by the &; open & quot; Squirt separated from the room.","","","Nicht "abgeschlossenes" Bad/WC im Zimmer gewöhnungsbedürftig. Das Bad/WC ist durch Mattglas und (wenn nicht geduscht wird) durch die "offene" Duschkabinentür vom Zimmer abgetrennt.","",
"Anonymous","Germany","Group of friends","8.3","Very good","24 July 2014","Very friendly staff, good position for the commuter train, in hotel near to eat lots of possibilities, the equipment super hotels with air conditioning !!!!!","","","sehr freundliches personal,gute lage zur s-bahn,in hotelnähe viele möglichkeiten essen zu gehen,ausstattung des hotels mit klimaanlage super !!!!!","","",
"Anonymous","Germany","Couple","7.5","Preis und Leistung stimmen","23 July 2014","The breakfast was very good - The
Space could also be attractive out-equips.","The position on the railway line is not for light sleepers.
For me, no problem.","","Das Frühstück war sehr gut - Der
Raum könnte aber attraktiver ausge-stattet werden.","Die Lage an der Bahnlinie ist nichts für Gäste mit leichtem Schlaf.
Für mich kein Problem.","",
"Anonymous","Belgium","Couple","8.8","Fabulous","22 July 2014","Air conditioning. Price-performance ratio was top! Friendly and extremely helpful staff. Modern, clean room","","","Klimaanlage. Preis-Leistung top! Freundliches und extrem hilfsbereites Personal. Modernes, sauberes Zimmer","","",
"Anonymous","Germany","Group of friends","7.9","Good","22 July 2014","great breakfast buffet,
very great staff","The elevator is used to,","","tolles Frühstücksbuffett, 
sehr tolles Personal","Der Aufzug ist gewöhnungsbedürftig,","",
"Anonymous","Germany","Family","5","Passable","22 July 2014","clean good bed","The Bahn and S-Bahn run every 15 minutes right outside the window.
The toilet and shower are little separated from the sleeping area (only a 4.3 high glass wall) ... the noise was stressful.
Air-conditioning has to be very rustled, not only buzzed.
Lamp did not work and a new bulb could not be delivered.","","sauberes gutes Bett","Die Bahn und S-Bahn fahren alle 15 minuten direkt am Fenster vorbei. 
Das Klo und die Dusche sind wenig vom Schlafbereich abgetrennt (nur durch eine 3/4 hohe Glaswand)... das war geräuschbelastend.
Klima-anlage hat zu sehr geraschelt, nicht nur gesummt.
Lampe funktionierte nicht und eine neue Glühbirne konnte nicht geliefert werden.","",
"Anonymous","Germany","Couple","7.1","Good","21 July 2014","The first impression of the room was great. Staff largely friendly. Value for money for the location 1A.
Despite negative impressions, one can recommend the hotel.","Despite booking a quiet room, there was a room right near the railway. Mini-bar (fridge) was not cleaned for a long time. Seals in the shower were black. Dust on various furniture. A stain on the leather bed was not cleaned the whole stay.
General cleanliness should be improved.
No privacy as milk glazed bathroom.
An elevator was about three days a lamp is broken, as they are repaired they still hung from its socket.","","Der erste Eindruck vom Zimmer war Top. Personal weitgehend freundlich. Preis-Leistung für die Lage 1A.
Trotz negativen Eindrücken, kann man das Hotel weiterempfehlen.","Trotz Buchung eines ruhigen Zimmers, gab es ein Zimmer direkt am Bahngleis. Mini-Bar (Kühlschrank) war seit längerem nicht geputzt. Dichtungen in der Dusche waren schwarz. Staub auf diversen Möbeln. Ein Fleck am Bettleder war den ganzen Aufenthalt nicht geputzt worden. 
Allgemein sollte die Sauberkeit verbessert werden.
Keine Intimsphäre da Milchverglastes Bad.
Im Aufzug war ca 3 Tage eine Lampe defekt, als man sie reparierte hing sie weiterhin aus der Fassung.","",
"Anonymous","Germany","Couple","7.1","Good","20 July 2014","Modern furnishings.
Central location.","No shower, just a bathtub.
Pillows very uncomfortable.
No door on the bathroom, just an old curtain.
Dirty window.
Stains from water damage on the ceiling.
Very noisy due to S-Bahn.
Breakfast too expensive.
Mini television.","","Moderne Einrichtung.
Zentrale Lage.","Keine dusche, nur eine badewanne.
Kissen sehr unbequem.
Keine Tür vor dem Bad, nur ein alter Vorhang. 
Dreckige Fensterbank. 
Flecken von Wasserschaden an der Decke.
Sehr laut wegen S-Bahn.
Frühstück viel zu teuer.
Mini-Fernsehr.","",
"Anonymous","Germany","Solo traveller","8.8","Fabulous","16 July 2014","Friendly, helpful staff, very neat, spacious rooms, functional and attractive amenities, best location and accessibility","All the best that the hotel the S / RB-line is close, is easily recognizable. I am however not interfere with traffic noise.","","Freundliches, hilfsbereites Personal, sehr ordentliches, geräumiges Zimmer, zweckmäßige und ansprechende Ausstattung, beste Lage und Erreichbarkeit","Alles bestens, dass das Hotel nah der S-/RB-Trasse liegt, ist leicht erkennbar. Mich stören Verkehrsgeräusche allerdings nicht.","",
"Anonymous","Germany","Couple","9.2","Überraschung!","15 July 2014","We'll gladly come again, are very satisfied!","","","Kommen gerne wieder, sind sehr zufrieden!","","",
"Anonymous","Germany","Couple","7.9","Good","13 July 2014","Modern room amenities. Good location, close to the Ku'damm.","(Near light rail) noisy at night","","Moderne Zimmerausstattung . Gute Lage ,nahe am Ku'damm .","Nachts laut ( s-Bahn nähe)","",
"Anonymous","Germany","Couple","7.9","Good","8 July 2014","Very centrally located, modern decor, lots of nice cafes nearby","Breakfast unfortunately a bit expensive, it is cheaper in the cafes, unfortunately the bathroom is only separated by a Glasewand","","Sehr zentral, moderne Einrichtung, viele nette Cafés in der Nähe","Frühstück leider etwas teuer, das gibt es in den Cafés günstiger, leider ist das Bad nur durch eine Glasewand getrennt","",
"Anonymous","Spain","Couple","5.8","Trenes","8 July 2014","The hotel is fine, is clean and very central aunq anadando can go to many places and has metro, train and bus nearby. The price is good for being a capital","The railway line is next, until 12 pm are constantly going on and the noise is very annoying. At 6 in the morn repass ....","","El hotel esta bien, es limpio y aunq no muy centrico se puede ir anadando a muchos sitios y tiene metro, tren y autobus cerca. El precio esta bien para ser una capital","La via del tren esta al lado, hasta las 12 de la noche estan constantemente pasando y el ruido es muy muy molesto. A las 6 de la mañan vuelven a pasar....","",
"Anonymous","Germany","Couple","8.8","Fabulous","8 July 2014","The room was very clean and stylish furnishings","","","Das Zimmer war sehr sauber und stilvoll eingerichtet","","",
"Anonymous","Germany","Couple","9.2","Gutes Hotel in Top Lage","8 July 2014","nice rooms
great breakfast
Everything was very clean and well maintained","The volume of the nearby elevated train.","","schöne Zimmer
tolles Frühstück
alles sehr sauber und gepflegt","Die Lautstärke der nahen Hochbahn.","",
"Anonymous","Germany","Couple","5.4","Passable","5 July 2014","","No Internet. Informed was not incurred fuel costs","","","Kein Internet. Wurde nicht über anfallende Benzinkosten aufgeklärt","",
"Anonymous","Russia","Couple","6.7","А из окна железная дорога видна.","4 July 2014","Unusual bathroom design with matte wall.","The hotel is right next to the railroad, train, though not as noisy as our own, but I still hear them, and they go very often. Designed in the original room, but the bathroom wall does not reach the ceiling and all the smells quickly spread into the room. Parking is in the courtyard and underground.One evening came and the yard did not have seats, asked for remote underground parking - a feeling that there do not go over the years the staff - all in a web of orphan packages hang, there is no convenient exit to the rooms. To exit had to open the gate again.","","Необычный дизайн ванной комнаты с матовой перегородкой.","Отель находится прямо около железной дороги, поезда хоть и не такие шумные как наши, но все равно их слышно и ходят они очень часто. Дизайн в комнате оригинальный, но перегородка в ванную комнату не доходит до потолка и все запахи быстро распространяются в комнату. Парковка есть во дворе и подземная. В один вечер приехали и во дворе не было мест, попросили пульт для подземной парковки - такое ощущение, что туда годами не заходят сотрудники - все в паутине, бесхозные пакеты висят, нет удобного выхода в к номерам. Чтобы выйти пришлось открывать опять ворота.","",
"Anonymous","Italy","Solo traveller","4.2","Disappointing","1 July 2014","","Aside from the convenience of the S-Bahn (2 min walk), the area is quite sad. The common areas are almost equal to the reception / bar and the outdoor courtyard / parking: whereas the wifi does not work in the room, are rather uncomfortable environments. Also noteworthy is some flaw in the bathroom: zero privacy if one is not alone, as it is all organized in style & quot; open space & quot; (Frosted glass door, no division / closing walls from floor to ceiling, shower included)","","","A parte la comodità della S-Bahn (2 min a piedi), la zona è alquanto triste. Le aree comuni corrispondono praticamente alla reception/bar ed al cortile esterno/parcheggio: considerando che la wifi non funziona in camera, sono ambienti piuttosto disagevoli. Da segnalare anche alcune pecche del bagno: zero privacy se non si è soli, in quanto è tutto organizzato in stile "open space" (porta in vetro satinato, nessuna divisione/chiusura con muri da terra a soffitto, doccia inclusa)","",
"Anonymous","Germany","Solo traveller","9.2","Superb","1 July 2014","very courteous and friendly staff","Just off the S-Bahn line","","das sehr zuvorkommende und freundliche Personal","die direkte Lage an der S-Bahnstrecke","",
"Anonymous","Germany","Solo traveller","6.3","Pleasant","29 June 2014","","For the hearing impaired highly recommended, otherwise you can sleep with the ear directly on the rails of the main crossing in Berlin, ie ICE, IC, S-Bahn, RegioExpress minute. Who dabeihat no earplugs or want to sleep with the windows open, the night would be better to go through in a club rather than lie down in bed.","","","Für Schwerhörige absolut empfehlenswert, ansonsten schläft man mit dem Ohr direkt auf den Schienen der Haupt-Bahnverbindung durch Berlin, d.h. ICE, IC, S-Bahn, Regioexpress im Minutentakt. Wer keine Ohrstöpsel dabeihat oder bei offenem Fenster schlafen will, sollte die Nacht lieber in einem Club durchmachen anstatt sich ins Bett zu legen.","",
"Anonymous","Germany","Couple","7.1","Good","28 June 2014","","Location directly on the S-Bahn line","","","Lage direkt an der S-Bahn-Linie","",
"Anonymous","Germany","Solo traveller","8.3","Very good","27 June 2014","Location away from the city close, bargain price","Road from the train too, a bit noisy","","位置离市里很近，价格划算","离火车道太近，有点吵","",
"Anonymous","Germany","Solo traveller","7.1","Good","27 June 2014","","Too noisy with the window open","","","Zu laut bei geöffnetem Fenster","",
"Anonymous","Germany","Group of friends","8.8","Fabulous","26 June 2014","","The proximity to the railway track is a bit disturbing, but still in the green zone.","","","Die Nähe an den Bahnschien ist etwas störend, aber noch im grünen Bereich.","",
"Anonymous","Belgium","Solo traveller","7.5","Good","22 June 2014","I found the staff very friendly and helpful. Breakfast was very well looked after.","The AC made a lot of noise when it was on. When leaving the room during the day, the electricity was turned off. This also did not work. Refrigerator with mini-bar Annoying as it was warm weather. This also applies to the air conditioning.","","ik vond het personeel heel vriendelijk en behulpzaam. Ontbijt was heel goed verzorgd.","de airco maakte veel lawaai als deze aan stond. Als de kamer verlaten werd overdag, was de elektra uitgeschakeld. Daardoor werkte de koelkast met de minibar ook niet. Vervelend als het warm weer was. Dit geldt ook voor de airco.","",
"Anonymous","Germany","Group of friends","9.2","Superb","18 June 2014","In a wriklich great district of Berlin. We did not bother the S-Bahn.","You have to like that the toilet is not separated from the room (open-plan bathroom with frosted glass door), breakfast was not a highlight","","In einem wriklich tollen Stadtteil von Berlin. Uns hat die S-Bahn nicht gestört.","Man muss mögen dass die Toilette nicht abgetrennt vom Zimmer ist (offenes Bad mit Milchglastür), Frühstück war kein highlight","",
"Anonymous","Germany","Couple","9.2","Superb","16 June 2014","Helpfulness and friendliness of staff
The coffee tasted very good.","The breakfast room is a bit small.","","Hilfsbereitschaft und Freundlichkeit des Personals
Der Kaffee schmeckte sehr gut.","Der Frühstücksraum ist etwas klein.","",
"Anonymous","Germany","Group of friends","9.6","Exceptional","13 June 2014","Everything was very clean, good facilities, great overall impression of the hotel. Parking / underground parking directly at the hotel, central location, affordable price","In our room the bathroom had the toilet with only one half-height glass wall, which is already extremely uncomfortable.
If the window is open, the trains on the adjacent railway line very loud, but with the windows closed it is barely audible (air conditioning available)","","Alles sehr sauber, gute Ausstattung, insgesamt toller Eindruck vom Hotel. Parkplatz/Tiefgarage direkt am Hotel vorhanden, Zentrale Lage, günstiger Preis","In unserem Zimmer hatte das Bad mit der Toilette nur eine halbhohe Glaswand, das ist schon extrem unangenehm.
Wenn das Fenster offen ist sind die Züge auf der benachbarten Bahntrasse schon sehr laut, aber bei geschlossenem Fenster ist es kaum hörbar (Klimaanlage vorhanden)","",
"Anonymous","Germany","Couple","6.3","Pleasant","12 June 2014","Price","No WIFI in room & amp; According to da next train tracks","","Preis","Kein WIFI im Zimmer & Laut da neben Bahngleisen","",
"Anonymous","Germany","Couple","6.7","Pleasant","10 June 2014","Furnishings and equipment in the room, very modern and cozy","Do not put the bank. The carpet desperately needs cleaning. Otherwise okey.","","Die Ausstattung im Zimmer, sehr modern und gemütlich eingerichtet","Verschiebe nicht die Bank. Der Teppich benötigt dringend eine Reinigung. Sonst okey.","",
"Anonymous","Brazil","Solo traveller","9.2","Superb","10 June 2014","Service from the reception staff. Though a bit far from downtown access is quite easy and fast through the surface metro (S-Bahn) station, very close to the hotel (one block). Several restaurants around the hotel. Large, comfortable room, great value for money. Recommend the hotel and the city, I intend to return one day.","The wifi did not work in my room, which is why I had to go up to the hotel lobby to use the service, but nothing that hinders the overall rating of the hotel. Recommend to everyone.","","Atendimento da equipe da recepção. Apesar de ser um pouco distante do centro o acesso é bastante fácil e rápido através da estação de metrô de superfície(S-Bahn), muito próxima do hotel(uma quadra). Vários restaurantes ao redor do hotel. Quarto amplo e confortável, ótimo custo-benefício. Recomendo o hotel e a cidade, pretendo retornar um dia.","A internet wifi não funcionou no meu quarto, motivo pelo qual tive que ir até ao lobby do hotel para utilizar o serviço, mas nada que atrapalhe a avaliação geral do hotel. Recomendo a todos.","",
"Anonymous","Germany","Couple","7.5","Good","7 June 2014","The location of the hotel was perfect for our stay. The close proximity to Kurfürstendamm and connection to the S-Bahn is great.","Oh well. We read the reviews before. We knew what we getting into. The connection to the S-Bahn is better than you think. The Holtel is right on the railroad tracks. Here pass S-Bahn, Regio trains and long distance trains. The timing is phenomenal.
Who is looking for a quiet hotel, this is so out of place. Or to solve the problem with earplugs, then you can sleep very well in the very comfortable beds.
The noise is not as direct criticism of the hotel. That's the way in a big city.
However, what did not work and as we found, is completely outrageous, is to ask for a breakfast 10 euros and offer Aufbackbrötchen namely those that you recognize.","","Die Lage des Hotels war für unseren Aufenthalt perfekt. Die unmittelbare Nähe zum Kudamm und Anbindung an die S-Bahn ist super.","Nun ja. Wir haben die Bewertungen vorher gelesen. Wir wussten ja worauf wir uns einlassen. Die Anbindung zur S-Bahn ist besser als man denkt. Das Holtel liegt direkt an der Bahntrasse. Hier fahren S-Bahnen, RegioBahnen und Fernzüge vorbei. Die Taktung ist phänomenal. 
Wer also ein ruhiges Hotel sucht, ist hier also fehl am Platz. Oder man löst das Problem mit Ohrstöpsel, dann kann man in den sehr bequemen Betten sehr gut schlafen.
Die Lärmbelästigung ist als keine direkte Kritik am Hotel. Das ist halt so in einer Großstadt.
Was allerdings gar nicht ging und wie wir fanden, völlig unverschämt ist, ist für ein Frühstück 10 Euro zu verlangen und Aufbackbrötchen anzubieten und zwar solche denen man es ansieht.","",
"Anonymous","Germany","Group of friends","8.8","Fabulous","7 June 2014","Friendly staff, good room amenities,","Railway tracks and tram outside the hotel. TV broken, air conditioning was too loud.","","Freundliches Personal, gute Zimmerausstattung,","Bahngleise und S-Bahn vor dem Hotel. Fernseher kaputt, Klimaanlage war zu laut.","",
"Anonymous","Finland","Couple","6.7","Pleasant","4 June 2014","The room was beautiful and clean","The train track runs adjacent to and at night it is difficult to sleep when trains pass by the","","Huone oli kaunis ja siisti","Junanrata kulkee vieressä ja yöllä on vaikea nukkua kun junat kulkevat ohi","",
"Anonymous","Sweden","Solo traveller","8.8","Fabulous","3 June 2014","Location - close to the S-bahn and additionally plenty of restaurants around","S-bahn is just outside the building's gable. If you are noise sensitive, it can be a problem, especially if you have the window open.
A little odd solution with a glass wall that separated the room from the bathroom. The glass wall was not all the way up to the ceiling namely.","","Läget - nära till S-bahn och dessutom gott om restauranger runt omkring","S-bahn går precis utanför husets gavel. Är man bullerkänslig kan det vara ett problem, i synnerhet om man har fönstret öppet.
Lite udda lösning med en glasvägg som skilde rummet från badrummet. Glasväggen gick inte hela vägen upp till taket nämligen.","",
"Anonymous","France","Couple","6.7","Pleasant","2 June 2014","The functional bathroom and well appointed","The immediate and noisy near the railway line - a train every minute on average","","La salle de bain fonctionnelle et bien aménagée","La proximité immédiate et bruyante de la ligne de chemin de fer - un train chaque minute en moyenne","",
"Anonymous","Germany","Family","7.1","Good","1 June 2014","Friendly staff. Rich breakfast. Good location.","Wi-Fi reception only good in the lobby. At night, a little too loud due to railway line. Balcony was under water.","","Freundliches Personal. Reichhaltiges Frühstück. Gute Lage.","WLAN-Empfang nur gut in der Lobby. Nachts etwas zu laut aufgrund Bahnstrecke. Balkon stand unter Wasser.","",
"Anonymous","Germany","Solo traveller","9.2","Superb","1 June 2014","The price-performance ratio is very good and the breakfast buffet every euro value.","With the windows open, unfortunately, is the proximity to the subway a disadvantage. Closed the windows are soundproof - then I lacked the personal oxygen.","","Das Preis-Leistungs-Verhältnis ist sehr gut und das Frühstücksbuffet jeden Euro Wert.","Bei offenem Fenster ist leider die Nähe zur S-Bahn ein Nachteil. Geschlossen sind die Fenster schalldicht - dann fehlte mir persönlich der Sauerstoff.","",
"Anonymous","Germany","Couple","5.4","Passable","31 May 2014","","The path directly in front of the window. Dahet very loud. At night slept badly. Toilet right in the room. No privacy on the toilet.","","","Die Bahn direkt vor dem Fenster. Dahet sehr laut. Nachts schlecht geschlafen. Toilette direkt im Zimmer. Keine Intimsphäre auf der Toilette.","",
"Anonymous","Germany","Couple","8.3","Very good","31 May 2014","Very, very good breakfast and friendly staff.","The S-Bahn line runs nearby. This is a bit loud. We still slept well even with the windows open.","","Sehr, sehr gutes Frühstück und freundliches Personal.","Die S-Bahnlinie verläuft in unmittelbarer Nähe.  Das ist ein bisschen laut. Wir haben trotzdem auch bei offenem Fenster gut geschlafen.","",
"Anonymous","Germany","Solo traveller","7.5","Good","24 May 2014","Friendly staff","The train in the background. It was really hard loud ...","","Freundliches Personal","Die S-Bahn im Hintergrund. Es war echt heftig laut...","",
"Anonymous","Germany","Couple","8.3","Very good","22 May 2014","Staff is unfailingly friendly and helpful.
Good location.
Appealing Amenities.","The pillows are so big and plump that they can not really use it as a pillow.
The room to the back (partially) open bathroom with toilet in most of the rooms makes for the use of the room by two people using music discretion necessary. Unfortunately this does not help against odors. Conclusion: Fehlkonstruktuion.
As the hotel is right next to the S-Bahn, it may be too loud for sensitive people.","","Personal ist ausnahmslos freundlich und hilfsbereit.
Gute Lage.
Ansprechende Ausstattung.","Die Kopfkissen sind so groß und prall, dass man sie eigentlich nicht als Kopfkissen verwenden kann.
Das zum Zimmer hin (teil-)offene Bad mit Toilette in den meisten Zimmern macht bei Benutzung des Zimmers durch zwei Personen den Einsatz von Diskretionsmusik notwendig. Leider hilft das nicht gegen Gerüche. Fazit: Fehlkonstruktuion.
Da das Hotel direkt neben der S-Bahn liegt, kann es für empfindliche Leute zu laut sein.","",
"Anonymous","Germany","Couple","10","Exceptional","20 May 2014","Very comfortable, full breakfast","No door as a boundary to the bathroom. .zumindest to the toilet desirable","","Sehr komfortabel,  reichhaltiges Frühstück","Keine Tür als Abgrenzung zum Badezimmer. .zumindest zur Toilette wünschenswert","",
"Anonymous","Germany","Couple","10","Exceptional","18 May 2014","","The open bathroom in the room was a bit strange ... a shame that it was open to the top ...","","","Das offene badezimmer im Zimmer war etwas gewöhnungsbedürftig...schade das es nach oben offen war...","",
"Anonymous","Germany","Solo traveller","4.6","Disappointing","18 May 2014","Design","Hair in the shower, wet carpet, hair in the buffet","","Design","Haare in der Dusche, nasser Teppich, Haare im Buffet","",
