"Name","Country","Traveler Type","Score","Score Explanation","Date","Pros","Cons","Response","Pros Original","Cons Original","Response Original"
"Alla","Israel","","9.6","Exceptional","1 September 2014","Friendly and helpfull staff
Excellent location - just a couple of minutes to S-Bahn station and about 10 minutes to the central station
Clean and modern room - we really liked unusial designers decision with the bathroom door
Amazing breakfast, fresh, tasty and variative, we wanted to try it only once, but ended up ordering it each morning during our stay. Would definitely recommend it.","Wifi is only in lobby, but it wasn't a surprise, we knew about it. So I wouldn't really call it a disadvantage.","","Friendly and helpfull staff
Excellent location - just a couple of minutes to S-Bahn station and about 10 minutes to the central station
Clean and modern room - we really liked unusial designers decision with the bathroom door
Amazing breakfast, fresh, tasty and variative, we wanted to try it only once, but ended up ordering it each morning during our stay. Would definitely recommend it.","Wifi is only in lobby, but it wasn't a surprise, we knew about it. So I wouldn't really call it a disadvantage.","",
"Daphna","Israel","","8.8","Fabulous","7 April 2014","great neighborhood, close to public transportation and to almost everywhere. very very clean and quiet, except for the train. the staff was very kind and helpful, and has tried to assist me by finding a room that wasn't that close to the rail but keep in mind that all the hotel is practically adjacent to it","the railway is just outside the window, u could almost touch it, and when it's so quiet the roaring sound the train makes when it passes by (until very late at night and starting very early in the morning) is quite disturbing. if you are a light sleeper beware","","great neighborhood, close to public transportation and to almost everywhere. very very clean and quiet, except for the train. the staff was very kind and helpful, and has tried to assist me by finding a room that wasn't that close to the rail but keep in mind that all the hotel is practically adjacent to it","the railway is just outside the window, u could almost touch it, and when it's so quiet the roaring sound the train makes when it passes by (until very late at night and starting very early in the morning) is quite disturbing. if you are a light sleeper beware","",
"Ben","United Kingdom","","9.6","Exceptional","21 September 2014","Handy for SBahn station.
Nice couple of bars and restaurants nearby.","Close to S Bahn line.  Tho I must admit it didn't disturb my sleep.
Wifi coverage was quite weak.","","Handy for SBahn station.
Nice couple of bars and restaurants nearby.","Close to S Bahn line.  Tho I must admit it didn't disturb my sleep.
Wifi coverage was quite weak.","",
"Katarzyna","Poland","","9.5","Exceptional","4 September 2014","We stayed in Berlin for two nights in a double room. Maybe it wasn't too huge neither too luxurious. But the room was modern, very bright, specious, and CLEAN. We had a big bed there, TV, air-condition and small fridge. We had a bathroom with glass door, which was pretty cool, especially for a young couple ;) It was really nice place - they cleaned everyday and brought us fresh towels and mini - soups and shampoos! 
The hotel isn't exactly in city center, but it shouldn't be a problem to get somewhere in Berlin, it's very close to Kurfurstendamm as well :)) It's worth its price and I would highly recommend that place. I hope to come back there one day :)","The building from the street doesn't encourage, it seems to be a bit old, but if you get inside, you won't regret it! 
The only problem was that Wi-Fi  wasn't available in the room, it was reachable only in reception.","","We stayed in Berlin for two nights in a double room. Maybe it wasn't too huge neither too luxurious. But the room was modern, very bright, specious, and CLEAN. We had a big bed there, TV, air-condition and small fridge. We had a bathroom with glass door, which was pretty cool, especially for a young couple ;) It was really nice place - they cleaned everyday and brought us fresh towels and mini - soups and shampoos! 
The hotel isn't exactly in city center, but it shouldn't be a problem to get somewhere in Berlin, it's very close to Kurfurstendamm as well :)) It's worth its price and I would highly recommend that place. I hope to come back there one day :)","The building from the street doesn't encourage, it seems to be a bit old, but if you get inside, you won't regret it! 
The only problem was that Wi-Fi  wasn't available in the room, it was reachable only in reception.","",
"Lauri","Finland","","7.5","Good","1 September 2014","","The breakfast hall is too small during the most rushed season","","","The breakfast hall is too small during the most rushed season","",
"Viktar","Russia","","9.2","Superb","10 August 2014","Breakfasts are expensive, but worth it.","Internet in rooms only by ethernet cable.","","Breakfasts are expensive, but worth it.","Internet in rooms only by ethernet cable.","",
"Mohamadreza","Germany","","8.8","Fabulous","27 July 2014","big room, very clean with big modern bathroom.
good breakfast
fair price
close to subway station
quiet","no internet access in rooms,just in public areas of hotel.","","big room, very clean with big modern bathroom.
good breakfast
fair price
close to subway station
quiet","no internet access in rooms,just in public areas of hotel.","",
"Jacqueline","U.S.A.","","6.3","Pleasant","27 July 2014","The staff was friendly and tried to accommodate my requests. The night clerk Martinez was especially wonderful.","The lift area looks trashy. The exterior of the hotel needs to have a facelift. The hot water was out for one of the days and the shower curtain had mildew in room 411.","","The staff was friendly and tried to accommodate my requests. The night clerk Martinez was especially wonderful.","The lift area looks trashy. The exterior of the hotel needs to have a facelift. The hot water was out for one of the days and the shower curtain had mildew in room 411.","",
"Jeremy","United Kingdom","","6.7","Pleasant","26 July 2014","Good location","Air con was more like a warm air fan.. Toiletries not provided everyday.","","Good location","Air con was more like a warm air fan.. Toiletries not provided everyday.","",
"Melissa","Canada","","10","Exceptional","20 July 2014","Everything was great about this hotel. Showers are hazy, so privacy might be an issue to some people. A bit far, but the tram is right there. Enjoyed the patio greatly","wifi in the lobby, LAN in rooms only","","Everything was great about this hotel. Showers are hazy, so privacy might be an issue to some people. A bit far, but the tram is right there. Enjoyed the patio greatly","wifi in the lobby, LAN in rooms only","",
"Yasser","Germany","","8.8","Fabulous","6 July 2014","Location was great and the staff were friendly","They should think about renovating the windows, especially considering the hotel's proximity to the S-Bahn station.","","Location was great and the staff were friendly","They should think about renovating the windows, especially considering the hotel's proximity to the S-Bahn station.","",
"Kristaps","Latvia","","8.3","Very good","26 June 2014","Just 4 blocks from the Kurfurstendamm which is cool. Another great feature is a car parking in the yard.","No WiFi in the room!!","","Just 4 blocks from the Kurfurstendamm which is cool. Another great feature is a car parking in the yard.","No WiFi in the room!!","",
"Alicja","Poland","","10","Exceptional","21 June 2014","Very good location, friendly staff, clean - everything PERFECT!!!!","","","Very good location, friendly staff, clean - everything PERFECT!!!!","","",
"Nikola","Bulgaria","","9.2","Superb","18 June 2014","The location of the hotel is great. The room was extremely clean.","I'm not sure abouth the bathroom decision but for several days I can deal with that.","","The location of the hotel is great. The room was extremely clean.","I'm not sure abouth the bathroom decision but for several days I can deal with that.","",
"Yan","Switzerland","","10","Exceptional","17 June 2014","In a very nice community in ex western Berlin. Lots of book stores, restaurants and cafe nearby, very local. Room clean and spacious. Very good value for money","","","In a very nice community in ex western Berlin. Lots of book stores, restaurants and cafe nearby, very local. Room clean and spacious. Very good value for money","","",
"Jan","Poland","","9.6","Exceptional","12 June 2014","2 minutes walk to the S-Bahn, clean and quiet room despite the nearby railway, well working air-condition, very polite staff, lots of nice restaurants around","","","2 minutes walk to the S-Bahn, clean and quiet room despite the nearby railway, well working air-condition, very polite staff, lots of nice restaurants around","","",
"James","U.S.A.","","9.2","Superb","10 June 2014","On-site parking.","1) Expensive breakfast. 
2) Our room on the sunset side was super hot in the evening. Whenever we left the room, we had to remove the key card that left the air conditioning going. This made the room super hot.","","On-site parking.","1) Expensive breakfast. 
2) Our room on the sunset side was super hot in the evening. Whenever we left the room, we had to remove the key card that left the air conditioning going. This made the room super hot.","",
"Vicol","Czech Republic","","10","Exceptional","6 June 2014","great hotel and great price.thank you!!!","","","great hotel and great price.thank you!!!","","",
"Lauren","Netherlands","","7.5","Good","4 June 2014","The bed, air conditioning and English tv channels were really nice. Even though there were only two English channels.","That in the picture our room came with a bath, but when we arrived there was only a shower. When we asked to switch rooms they said they were all full.","","The bed, air conditioning and English tv channels were really nice. Even though there were only two English channels.","That in the picture our room came with a bath, but when we arrived there was only a shower. When we asked to switch rooms they said they were all full.","",
"Nathalie","Ireland","","10","Exceptional","12 May 2014","Very good location, near to public transports. The room was very clean and the staff friendly. It is worth it to try the breakfast!","","","Very good location, near to public transports. The room was very clean and the staff friendly. It is worth it to try the breakfast!","","",
"Tomasz","Poland","","7.1","Good","23 April 2014","excellent breakfast, good location, friendly staff, nice design of the rooms","lack of privacy in the bathrooms (they are not separate room but are in the same room only separated by glass wall), no wi-fi coverage in rooms, windows are very close to railway","","excellent breakfast, good location, friendly staff, nice design of the rooms","lack of privacy in the bathrooms (they are not separate room but are in the same room only separated by glass wall), no wi-fi coverage in rooms, windows are very close to railway","",
"Paulina","Poland","","8.8","Fabulous","10 April 2014","The staff members were very helpful, nice and willing to answer any questions regarding transport and places worth-visiting while in Berlin.","","","The staff members were very helpful, nice and willing to answer any questions regarding transport and places worth-visiting while in Berlin.","","",
"Herman","Netherlands","","9.6","Exceptional","15 March 2014","Really good staff, well furnished rooms, with efficient usage of space. Overall a really good hotel, I stayed there twice, location is perfect and the rooms are perfect","Pillows are not so good, I felt like I was lying on the mattress","","Really good staff, well furnished rooms, with efficient usage of space. Overall a really good hotel, I stayed there twice, location is perfect and the rooms are perfect","Pillows are not so good, I felt like I was lying on the mattress","",
"Evangelos","Greece","","9.2","Superb","26 February 2014","The staff was very polite and helphul. The room was very clean and had a beautiful style. There were a lot of good restaurants nearby and it is really easy to commute.","We could not access the WiFi in our room (poor signal) and there was a little noise from the trains.","","The staff was very polite and helphul. The room was very clean and had a beautiful style. There were a lot of good restaurants nearby and it is really easy to commute.","We could not access the WiFi in our room (poor signal) and there was a little noise from the trains.","",
"Rhiannon","United Kingdom","","10","Exceptional","25 February 2014","Very close to S-Bahn, 10min journey to the centre of Berlin. Clean and modern. Very helpful and pleasant staff.","Breakfast was expensive so we ate out.","","Very close to S-Bahn, 10min journey to the centre of Berlin. Clean and modern. Very helpful and pleasant staff.","Breakfast was expensive so we ate out.","",
"Georgios","Greece","","9.2","Superb","10 February 2014","Very nice hotel, quite despite its location by the railway. Comfortable and modern rooms, friendly staff, good service, perfect location - being short walking distance from K-dam! We liked it a lot!
George, Athens, Greece","","","Very nice hotel, quite despite its location by the railway. Comfortable and modern rooms, friendly staff, good service, perfect location - being short walking distance from K-dam! We liked it a lot!
George, Athens, Greece","","",
"Sergiy","Germany","","8.3","Very good","5 February 2014","Location
Rooms","The elevator didn't work","","Location
Rooms","The elevator didn't work","",
"Kirill","Russia","","8.3","Very good","13 January 2014","Large and clean room, big and soft bed.","A bit remote from center, but still okay. Located near metro line, but it's not disturbing.","","Large and clean room, big and soft bed.","A bit remote from center, but still okay. Located near metro line, but it's not disturbing.","",
"Martina","Slovakia","","10","Exceptional","3 January 2014","very modern hotel
breakfast were great
didn't really hear the train
easy to get to the train and get to the city","","","very modern hotel
breakfast were great
didn't really hear the train
easy to get to the train and get to the city","","",
"Arina","Ukraine","","10","Exceptional","22 December 2013","all good!","","","alles gut!","","",
"Utsanee","Thailand","","7.1","Good","11 December 2013","Nice room
Very good location","No Internet in d room
Uncomfy pillow","","Nice room
Very good location","No Internet in d room
Uncomfy pillow","",
"João","Portugal","","6.7","Pleasant","11 December 2013","1. Cost-quality
2. Staff","3. Location although the magnificient transport lan to everywhere every minute","","1. Cost-quality
2. Staff","3. Location although the magnificient transport lan to everywhere every minute","",
"Ben","United Kingdom","","6.7","Pleasant","30 November 2013","Rooms were nice and clean and updated.","Nothing in hotel. Tiny little bar.","","Rooms were nice and clean and updated.","Nothing in hotel. Tiny little bar.","",
"Kirk","United Kingdom","","7.5","Good","26 November 2013","Clean Modern room
Comfortable and spacious.","Toilet area a little too exposed, although there was a screen separating the sleeping area from the bathroom area it felt openplan which was a little uncomfortable.","","Clean Modern room
Comfortable and spacious.","Toilet area a little too exposed, although there was a screen separating the sleeping area from the bathroom area it felt openplan which was a little uncomfortable.","",
"Anne-leena","Finland","","8.8","Fabulous","25 November 2013","The breakfast is absolutely worth the extra 10 euros.
Superclean!
Close to S-bahn station. The railway is close but the noice didn't wake you up in the night.","The open bathroom","","The breakfast is absolutely worth the extra 10 euros.
Superclean!
Close to S-bahn station. The railway is close but the noice didn't wake you up in the night.","The open bathroom","",
"Tereza","Czech Republic","","9.6","Exceptional","22 November 2013","friendly and helpful staff, 
nice, modern and clean room
parking space,
near the public transport station","","","friendly and helpful staff, 
nice, modern and clean room
parking space,
near the public transport station","","",
"Kristina","Czech Republic","","9.2","Superb","4 November 2013","Friendly staff
Tasty breakfast
Perfect location at the city centre
Cleanliness","As mentioned in other comments, the bathroom right inside room doesn't provide any privacy at all.","","Friendly staff
Tasty breakfast
Perfect location at the city centre
Cleanliness","As mentioned in other comments, the bathroom right inside room doesn't provide any privacy at all.","",
"Gregory","United Kingdom","","8.3","Very good","29 October 2013","Very easy to get to from airport, good quiet location though close to railway lines, but not too disturbing. Excellent choice of restaurants within walking distance. Easy walk to Tiegarten & City centre","Walls were a bit thin, we could hear the incessant coughing from next door. Also lift didn't work so we had to walk six flights; didn't bother us but some guests may find it difficult","","Very easy to get to from airport, good quiet location though close to railway lines, but not too disturbing. Excellent choice of restaurants within walking distance. Easy walk to Tiegarten & City centre","Walls were a bit thin, we could hear the incessant coughing from next door. Also lift didn't work so we had to walk six flights; didn't bother us but some guests may find it difficult","",
"Arina","Ukraine","","10","Exceptional","28 October 2013","It is not the first time when i stop in this hotel and I like everything about it. everything is good to me. Comfortably, purely. Good breakfasts.","","","It is not the first time when i stop in this hotel and I like everything about it. everything is good to me. Comfortably, purely. Good breakfasts.","","",
"Asis","India","","9.2","Superb","23 October 2013","Excellent location waliking distance from S Bahn plenty choices of eating joints of various natures very close by.","Monotony of breakfast menu","","Excellent location waliking distance from S Bahn plenty choices of eating joints of various natures very close by.","Monotony of breakfast menu","",
"Dimitar","Bulgaria","","7.1","Good","18 October 2013","excellent location","too noisy - near the S-Bahn
when making the reservation I had a special request - to be as far as possible away from the S-Bahn and it was not fulfilled","","excellent location","too noisy - near the S-Bahn
when making the reservation I had a special request - to be as far as possible away from the S-Bahn and it was not fulfilled","",
"Dragos","Romania","","9.2","Superb","12 October 2013","neighbourhood, great restaurants around, breakfast, room, staff.","a little noisy cause of the close train tracks.","","neighbourhood, great restaurants around, breakfast, room, staff.","a little noisy cause of the close train tracks.","",
"Elsa","Sweden","","10","Exceptional","18 September 2013","the price, the breakfast buffet, nice staff, comfortable beds","No door into bathroom.","","the price, the breakfast buffet, nice staff, comfortable beds","No door into bathroom.","",
"Johan","Sweden","","10","Exceptional","18 September 2013","The staff were very friendly. They had a very good breakfast which was
worth the 10 euro. Close to Berlin city","","","The staff were very friendly. They had a very good breakfast which was
worth the 10 euro. Close to Berlin city","","",
"Anna","Russia","","9.2","Superb","17 September 2013","Nice room, staff and breakfast, private parking (cost 8 euro).","No internet in rooms and breakfast area. Only in lobby.","","Nice room, staff and breakfast, private parking (cost 8 euro).","No internet in rooms and breakfast area. Only in lobby.","",
"Michal","Poland","","7.1","Good","11 September 2013","Location
Location
Location","Train tracks nearby - might be very loud if you're not used to it
Show stopper: no internet access in the rooms.","","Location
Location
Location","Train tracks nearby - might be very loud if you're not used to it
Show stopper: no internet access in the rooms.","",
"Christos","Sweden","","8.8","Fabulous","5 September 2013","Very modern and fresh room. Really clean. Nice furniture. Parking available. Friendly and helpful staff. Central location with good public transportation.","No wi-fi in the rooms, quite long to the lobby there wi-fi is available (libby is at a separate building). No fridge and no balcony","","Very modern and fresh room. Really clean. Nice furniture. Parking available. Friendly and helpful staff. Central location with good public transportation.","No wi-fi in the rooms, quite long to the lobby there wi-fi is available (libby is at a separate building). No fridge and no balcony","",
"Łukasz","Poland","","6.7","Pleasant","23 August 2013","The hotel is situated near Kurfursterdamm Street (10mins walk) and near SBahn station Savignyplatz (3mins walk). There are many restaurants and cafes nearby - and they are cheaper than in the city center. Really tasty and various breakfast.","It is situated near railway track and you need to close the window if you want to sleep well. There is a good air-conditioning so it wasn't a problem, so it wasn't a problem in the summer, but I don't know what about the winter. I couldn't connect to the Internet, neither in the room, nor near the reception. There was no hot water in the last morning so I couldn't take a shower, but I got a 20-euro discount because of that.","","The hotel is situated near Kurfursterdamm Street (10mins walk) and near SBahn station Savignyplatz (3mins walk). There are many restaurants and cafes nearby - and they are cheaper than in the city center. Really tasty and various breakfast.","It is situated near railway track and you need to close the window if you want to sleep well. There is a good air-conditioning so it wasn't a problem, so it wasn't a problem in the summer, but I don't know what about the winter. I couldn't connect to the Internet, neither in the room, nor near the reception. There was no hot water in the last morning so I couldn't take a shower, but I got a 20-euro discount because of that.","",
"Hrvoje","Croatia","","8.3","Very good","22 August 2013","Clean, good beds and overall decoration, near S bahn station, garage","Transparent bathroom walls, a bit far from U bahn stations, no wifi on top floor","","Clean, good beds and overall decoration, near S bahn station, garage","Transparent bathroom walls, a bit far from U bahn stations, no wifi on top floor","",
"Julia","Russia","","6.3","Pleasant","15 August 2013","Good location, near Savigny platz
Clean room","Railway in the near of the windows of the Hotel
Unfriendly blond women at the reception
No wall between bedroom and bathroom
Steps at the entrance (hard to go inside with suitcases)","","Good location, near Savigny platz
Clean room","Railway in the near of the windows of the Hotel
Unfriendly blond women at the reception
No wall between bedroom and bathroom
Steps at the entrance (hard to go inside with suitcases)","",
"Jose","Australia","","8.3","Very good","12 August 2013","The rooms looks relatively new.
- the room was cleaned and the towels refreshed everyday
- we loved the breakfast (despite you have to pay for it)
- walking distance to metro station
- The staff was very helpfull and friendly
- fruit at the reception
- I would stay there again","you have to pay an extra for having breakfast
- no free internet in the rooms
- the location is not quite close to the main atraction, you need to take the metro (10 mins), however this allow the hotel to offer low rates.
- the separation between the bathroom and the room is not totally hermetic which may be unconfotable for some couples.",""," The rooms looks relatively new.
- the room was cleaned and the towels refreshed everyday
- we loved the breakfast (despite you have to pay for it)
- walking distance to metro station
- The staff was very helpfull and friendly
- fruit at the reception
- I would stay there again"," you have to pay an extra for having breakfast
- no free internet in the rooms
- the location is not quite close to the main atraction, you need to take the metro (10 mins), however this allow the hotel to offer low rates.
- the separation between the bathroom and the room is not totally hermetic which may be unconfotable for some couples.","",
"Ausnat","Israel","","9.2","Superb","24 August 2014","","","","","","",
"Elaheh","United Kingdom","","8.3","Very good","5 October 2014","","","","","","",
"Victoria","Japan","","8.8","Fabulous","23 September 2014","","","","","","",
"Siyu","Poland","","7.5","Good","31 August 2014","","","","","","",
"Ali","Canada","","4.2","Disappointing","3 July 2014","","","","","","",
"Barbara","Slovakia","","7.9","Good","29 June 2014","","","","","","",
"Ervins","Latvia","","7.5","Good","26 June 2014","","","","","","",
"Adinko","Bulgaria","","10","Exceptional","9 June 2014","","","","","","",
"Mark","United Kingdom","","9.2","Superb","13 May 2014","","","","","","",
"Martina","Czech Republic","","9.6","Exceptional","6 May 2014","","","","","","",
"Shasha","United Kingdom","","7.5","Good","13 March 2014","","","","","","",
"Dan","Poland","","7.9","Good","24 November 2013","","","","","","",
"Anonymous","United Kingdom","","8.8","Fabulous","18 September 2014","","Internet connection almost doesnt exist and no cables available.","","","Internet connection almost doesnt exist and no cables available.","",
